{
  "schema": "md2hwp.ir",
  "ir_version": "0.2",
  "metadata": {},
  "blocks": [
    {
      "type": "verbatim_block",
      "lines": ["출처: 박스 본문", "{{md2hwp:slot:box.content}}"],
      "source": [
        { "type": "text", "value": "{{md2hwp:slot:box.content}}" },
        { "type": "space" },
        { "type": "strong", "inlines": [{ "type": "text", "value": "작성자" }] }
      ]
    },
    {
      "type": "verbatim_block",
      "lines": ["출처: 두 번째 박스 본문"],
      "source": [{ "type": "emph", "inlines": [{ "type": "text", "value": "조사자" }] }]
    }
  ]
}
